{
  "schema_version": "2.0",
  "generated_at": "2026-09-13T18:45:04.222618+00:00",
  "data_as_of": "2026-09-11",
  "source_date": "2026-09-11",
  "data_source": "REAL_DATA",
  "universe_info": {
    "universe_type": "VN30_MIDCAP_LEADERS",
    "universe_size": 42
  },
  "market": {
    "regime": "BULL",
    "regime_score": 65.0,
    "confidence": 0.85,
    "metrics": {
      "vnindex_value": 1795.21,
      "vnindex_change_pct": -1.86,
      "vn30_change_pct": -2.03,
      "market_breadth_ratio": 0.26,
      "volatility": 0.1823,
      "volume_20d_ratio": 1.22
    }
  },
  "summary": {
    "total_scanned": 42,
    "buy_count": 6,
    "watch_count": 5,
    "hold_count": 3,
    "sell_count": 26,
    "avoid_count": 2
  },
  "recommendations": [
    {
      "symbol": "ACB",
      "company_name": "Ngân hàng TMCP Á Châu",
      "exchange": "HOSE",
      "sector": "Ngân hàng",
      "action": "SELL",
      "model_version": "2.0",
      "data_quality": "SUFFICIENT",
      "data_as_of": "2026-09-11",
      "data_source": "REAL_DATA",
      "signal_score": 36.3,
      "risk_adjusted_score": 33.2,
      "score_components": {
        "trend": 0.0,
        "momentum": 45.0,
        "volume": 50.0,
        "relative_strength": 35.0,
        "divergence": 82.0
      },
      "confidence": 0.62,
      "risk_level": "MEDIUM",
      "expected_return": {
        "expected_return_5d": null,
        "expected_return_10d": null,
        "expected_return_20d": null
      },
      "risk_metrics": {
        "var_t25": -0.0381,
        "es_t25": -0.0471,
        "volatility_60d": 0.2107,
        "max_drawdown": -0.1949,
        "liquidity_score": 60.0,
        "avg_value_20d": 0.17
      },
      "trade_plan": {
        "current_price": 22050.0,
        "entry_low": null,
        "entry_high": null,
        "stop_loss": null,
        "tp1": null,
        "tp2": null,
        "risk_reward": null,
        "position_percent": 0.0
      },
      "reasons": [
        "Chỉ báo RSI (54.1) nằm trong vùng an toàn (45 - 65).",
        "Xuất hiện tín hiệu Phân Kỳ Dương trên khung 1D.",
        "Xuất hiện tín hiệu Phân Kỳ Dương trên khung 1W."
      ],
      "warnings": [
        "Giá đóng cửa (22.050 VNĐ) nằm dưới đường xu hướng MA20 (22.258 VNĐ).",
        "MACD Histogram âm, báo hiệu áp lực điều chỉnh."
      ],
      "invalidation": [
        "Giá vượt lên trên MA20 kèm thanh khoản bùng nổ vượt 1.5x bình quân 20 phiên.",
        "Tín hiệu phân kỳ dương hình thành trên khung 1D."
      ],
      "divergence": {
        "1H": "NONE",
        "1D": "BULLISH",
        "1W": "BULLISH",
        "1M": "NONE"
      }
    },
    {
      "symbol": "BCM",
      "company_name": "Tổng Công ty Đầu tư và Phát triển Công nghiệp",
      "exchange": "HOSE",
      "sector": "Bất động sản KCN",
      "action": "SELL",
      "model_version": "2.0",
      "data_quality": "SUFFICIENT",
      "data_as_of": "2026-09-11",
      "data_source": "REAL_DATA",
      "signal_score": 21.0,
      "risk_adjusted_score": 12.5,
      "score_components": {
        "trend": 0.0,
        "momentum": 15.0,
        "volume": 50.0,
        "relative_strength": 15.0,
        "divergence": 50.0
      },
      "confidence": 0.65,
      "risk_level": "HIGH",
      "expected_return": {
        "expected_return_5d": null,
        "expected_return_10d": null,
        "expected_return_20d": null
      },
      "risk_metrics": {
        "var_t25": -0.0846,
        "es_t25": -0.105,
        "volatility_60d": 0.4916,
        "max_drawdown": -0.5549,
        "liquidity_score": 16.2,
        "avg_value_20d": 0.04
      },
      "trade_plan": {
        "current_price": 38850.0,
        "entry_low": null,
        "entry_high": null,
        "stop_loss": null,
        "tp1": null,
        "tp2": null,
        "risk_reward": null,
        "position_percent": 0.0
      },
      "reasons": [],
      "warnings": [
        "Giá đóng cửa (38.850 VNĐ) nằm dưới đường xu hướng MA20 (42.350 VNĐ).",
        "MACD Histogram âm, báo hiệu áp lực điều chỉnh.",
        "Sức mạnh tương quan (RS) yếu hơn VN-Index (-11.8%)."
      ],
      "invalidation": [
        "Giá vượt lên trên MA20 kèm thanh khoản bùng nổ vượt 1.5x bình quân 20 phiên.",
        "Tín hiệu phân kỳ dương hình thành trên khung 1D."
      ],
      "divergence": {
        "1H": "NONE",
        "1D": "NONE",
        "1W": "NONE",
        "1M": "NONE"
      }
    },
    {
      "symbol": "BID",
      "company_name": "Ngân hàng TMCP Đầu tư và Phát triển Việt Nam",
      "exchange": "HOSE",
      "sector": "Ngân hàng",
      "action": "SELL",
      "model_version": "2.0",
      "data_quality": "SUFFICIENT",
      "data_as_of": "2026-09-11",
      "data_source": "REAL_DATA",
      "signal_score": 44.5,
      "risk_adjusted_score": 35.6,
      "score_components": {
        "trend": 20.0,
        "momentum": 45.0,
        "volume": 85.0,
        "relative_strength": 35.0,
        "divergence": 62.0
      },
      "confidence": 0.57,
      "risk_level": "HIGH",
      "expected_return": {
        "expected_return_5d": null,
        "expected_return_10d": null,
        "expected_return_20d": null
      },
      "risk_metrics": {
        "var_t25": -0.0534,
        "es_t25": -0.0726,
        "volatility_60d": 0.2518,
        "max_drawdown": -0.3618,
        "liquidity_score": 45.0,
        "avg_value_20d": 0.12
      },
      "trade_plan": {
        "current_price": 35600.0,
        "entry_low": null,
        "entry_high": null,
        "stop_loss": null,
        "tp1": null,
        "tp2": null,
        "risk_reward": null,
        "position_percent": 0.0
      },
      "reasons": [
        "Khối lượng bùng nổ 1.5x so với bình quân 20 phiên.",
        "Chỉ báo RSI (48.7) nằm trong vùng an toàn (45 - 65).",
        "Xuất hiện tín hiệu Phân Kỳ Dương trên khung 1W."
      ],
      "warnings": [
        "Giá đóng cửa (35.600 VNĐ) nằm dưới đường xu hướng MA20 (36.353 VNĐ).",
        "MACD Histogram âm, báo hiệu áp lực điều chỉnh."
      ],
      "invalidation": [
        "Giá vượt lên trên MA20 kèm thanh khoản bùng nổ vượt 1.5x bình quân 20 phiên.",
        "Tín hiệu phân kỳ dương hình thành trên khung 1D."
      ],
      "divergence": {
        "1H": "NONE",
        "1D": "NONE",
        "1W": "BULLISH",
        "1M": "NONE"
      }
    },
    {
      "symbol": "BVH",
      "company_name": "Tập đoàn Bảo Việt",
      "exchange": "HOSE",
      "sector": "Bảo hiểm",
      "action": "SELL",
      "model_version": "2.0",
      "data_quality": "SUFFICIENT",
      "data_as_of": "2026-09-10",
      "data_source": "REAL_DATA",
      "signal_score": 32.0,
      "risk_adjusted_score": 23.2,
      "score_components": {
        "trend": 50.0,
        "momentum": 5.0,
        "volume": 20.0,
        "relative_strength": 35.0,
        "divergence": 50.0
      },
      "confidence": 0.65,
      "risk_level": "HIGH",
      "expected_return": {
        "expected_return_5d": null,
        "expected_return_10d": null,
        "expected_return_20d": null
      },
      "risk_metrics": {
        "var_t25": -0.0612,
        "es_t25": -0.0756,
        "volatility_60d": 0.3442,
        "max_drawdown": -0.3419,
        "liquidity_score": 10.0,
        "avg_value_20d": 0.03
      },
      "trade_plan": {
        "current_price": 63000.0,
        "entry_low": null,
        "entry_high": null,
        "stop_loss": null,
        "tp1": null,
        "tp2": null,
        "risk_reward": null,
        "position_percent": 0.0
      },
      "reasons": [
        "Giá đóng cửa nằm trên hỗ trợ trung hạn MA50 (62.396 VNĐ)."
      ],
      "warnings": [
        "Giá đóng cửa (63.000 VNĐ) nằm dưới đường xu hướng MA20 (65.030 VNĐ).",
        "MACD Histogram âm, báo hiệu áp lực điều chỉnh.",
        "RSI (28.2) quá bán nặng (< 35)."
      ],
      "invalidation": [
        "Giá vượt lên trên MA20 kèm thanh khoản bùng nổ vượt 1.5x bình quân 20 phiên.",
        "Tín hiệu phân kỳ dương hình thành trên khung 1D."
      ],
      "divergence": {
        "1H": "NONE",
        "1D": "NONE",
        "1W": "NONE",
        "1M": "NONE"
      }
    },
    {
      "symbol": "CTG",
      "company_name": "Ngân hàng TMCP Công Thương Việt Nam",
      "exchange": "HOSE",
      "sector": "Ngân hàng",
      "action": "SELL",
      "model_version": "2.0",
      "data_quality": "SUFFICIENT",
      "data_as_of": "2026-09-10",
      "data_source": "REAL_DATA",
      "signal_score": 19.8,
      "risk_adjusted_score": 17.2,
      "score_components": {
        "trend": 0.0,
        "momentum": 15.0,
        "volume": 50.0,
        "relative_strength": 15.0,
        "divergence": 42.0
      },
      "confidence": 0.65,
      "risk_level": "HIGH",
      "expected_return": {
        "expected_return_5d": null,
        "expected_return_10d": null,
        "expected_return_20d": null
      },
      "risk_metrics": {
        "var_t25": -0.0482,
        "es_t25": -0.0667,
        "volatility_60d": 0.2337,
        "max_drawdown": -0.2966,
        "liquidity_score": 70.0,
        "avg_value_20d": 0.21
      },
      "trade_plan": {
        "current_price": 30550.0,
        "entry_low": null,
        "entry_high": null,
        "stop_loss": null,
        "tp1": null,
        "tp2": null,
        "risk_reward": null,
        "position_percent": 0.0
      },
      "reasons": [
        "Xuất hiện tín hiệu Phân Kỳ Dương trên khung 1W."
      ],
      "warnings": [
        "Giá đóng cửa (30.550 VNĐ) nằm dưới đường xu hướng MA20 (31.520 VNĐ).",
        "MACD Histogram âm, báo hiệu áp lực điều chỉnh.",
        "Sức mạnh tương quan (RS) yếu hơn VN-Index (-5.5%).",
        "Cảnh báo Phân Kỳ Âm trên khung 1D."
      ],
      "invalidation": [
        "Giá vượt lên trên MA20 kèm thanh khoản bùng nổ vượt 1.5x bình quân 20 phiên.",
        "Tín hiệu phân kỳ dương hình thành trên khung 1D."
      ],
      "divergence": {
        "1H": "NONE",
        "1D": "BEARISH",
        "1W": "BULLISH",
        "1M": "NONE"
      }
    },
    {
      "symbol": "FPT",